{
  "schema": "grep_plan_v1",
  "intent": {
    "schema": "grep_intent_v1",
    "prompt": "",
    "assumptions": [],
    "hints": {}
  },
  "intent_hash": "sha256:",
  "search": {
    "root": ".",
    "pattern": [],
    "glob": [],
    "exclude": [],
    "mode": "fixed",
    "case": "smart",
    "context": 0,
    "format": "auto",
    "max_lines": 500,
    "max_files": null,
    "max_matches": null,
    "parallelism": 4,
    "policy": {
      "hidden": false,
      "follow": false,
      "no_ignore": false
    }
  },
  "notes": {
    "strategy": "",
    "scope": "",
    "terms": ""
  }
}
